<?xml version="1.0" encoding="UTF-8"?>
<!--
  SaFariPark SFP+ editor
  Copyright (C) 2017 National Institute for Subatomic Physics Nikhef
  
  This program is free software: you can redistribute it and/or modify
  it under the terms of the GNU General Public License as published by
  the Free Software Foundation, either version 3 of the License, or
  (at your option) any later version.
  
  This program is distributed in the hope that it will be useful,
  but WITHOUT ANY WARRANTY; without even the implied warranty of
  MERCHANTABILITY or FITNESS FOR A PARTICULAR PURPOSE.  See the
  GNU General Public License for more details.
  
  You should have received a copy of the GNU General Public License
  along with this program.  If not, see <http://www.gnu.org/licenses/>.
-->


<!-- Adds support for the OE Solutions transceivers, as used in KM3NeT -->
<overlay 
	xmlns:xsi="http://www.w3.org/2001/XMLSchema-instance"
	xsi:noNamespaceSchemaLocation="sfpdd.xsd">
	
	<group id="root">
		<group label="OE Solutions custom">

			<group source-id="diag" showIf="isset(id.montype, 6)">
				<!-- implicit hard-coded password -->
				<password id="oe-password" offset="x7b" length="4" writable="true">
					<!-- for now constants must be binary hex strings. Sorry.  -->
					<const>4F455350</const>
				</password>
			</group>
			<group source-id="diag_p4" showIf="isset(id.montype, 6)">
				<uint label="Tune value" writable="true" 
					offset="x8B" length="2" level="basic"
					password-id="oe-password">
				</uint>
			</group>
			
		</group>
	</group>
</overlay>
